{
  "id": "plan-0001",
  "title": "Production-readiness roadmap",
  "spec": "docs/FUTURE.md + docs/TRD.md §11 (risks) and §13 (security production path)",
  "status": "in_progress",
  "createdAt": "2026-06-10T21:00:00Z",
  "updatedAt": "2026-06-10T22:05:00Z",
  "notes": [
    "Phases 1-3 are independent by artifacts and may be dispatched to parallel agents.",
    "Phase 5 intentionally depends on auth (phase 1): scoping the SSE feed is meaningless without an identity to scope to.",
    "phase-2 executed 2026-06-10 (user-reported: reload wiped My requests while the hold stayed at HCM). Implemented with zustand/persist + boot reconciliation; e2e/session.spec.ts covers reload mid-flight and decide-while-away."
  ],
  "phases": [
    {
      "id": "phase-1",
      "title": "Authentication & authorization boundary",
      "goal": "Replace the persona toggle with a real identity: employees file only for themselves, managers decide only for their reports, enforced server-side (TRD §13.3-1).",
      "dependsOn": [],
      "parallelizable": true,
      "status": "pending",
      "tasks": [
        {
          "id": "t1",
          "description": "Write failing route-handler tests: unauthenticated requests 401; employee filing for another employee 403; non-manager decision 403.",
          "status": "pending",
          "verification": "pnpm test (new auth tests red first, then green)"
        },
        {
          "id": "t2",
          "description": "Add session middleware (mock OIDC for demo: signed cookie with role+employeeId) and enforce in route handlers.",
          "status": "pending",
          "verification": "pnpm test && pnpm test:e2e"
        },
        {
          "id": "t3",
          "description": "Remove persona links from landing; derive view from session; update e2e to authenticate.",
          "status": "pending",
          "verification": "pnpm test:e2e"
        }
      ],
      "acceptance": [
        "No route handler trusts client-supplied employeeId without matching the session",
        "TRD §12/§13 updated: the toggle caveat is removed"
      ],
      "artifacts": ["src/app/api/hcm/", "src/views/", "e2e/", "docs/TRD.md"]
    },
    {
      "id": "phase-2",
      "title": "Persistent session ledger",
      "goal": "Survive reloads: persist the pending overlay (Zustand persist → localStorage) so an employee's in-flight requests outlive a refresh (TRD §11 known limitation).",
      "dependsOn": [],
      "parallelizable": true,
      "status": "completed",
      "tasks": [
        {
          "id": "t1",
          "description": "Failing test: ledger rehydrates from storage; contradicted/pre-confirmation phases reconcile against HCM records on boot (a request that verified while we were away must not double-hold).",
          "status": "completed",
          "verification": "pnpm test"
        },
        {
          "id": "t2",
          "description": "Add zustand/persist to requestLedger with a boot-time reconciliation pass (reuse syncDecisions + verification reads).",
          "status": "completed",
          "verification": "pnpm test && pnpm test:e2e"
        },
        {
          "id": "t3",
          "description": "E2E: file → reload → request still visible with correct phase.",
          "status": "completed",
          "verification": "pnpm test:e2e"
        }
      ],
      "acceptance": [
        "Reload mid-flight never double-counts a hold (projection invariant holds across rehydration)"
      ],
      "artifacts": ["src/data/requestLedger.ts", "src/data/", "e2e/"]
    },
    {
      "id": "phase-3",
      "title": "Write idempotency",
      "goal": "Client retries after ambiguous failures cannot double-file: filings carry an idempotency key the mock HCM deduplicates on (TRD §13.3-4).",
      "dependsOn": [],
      "parallelizable": true,
      "status": "pending",
      "tasks": [
        {
          "id": "t1",
          "description": "Failing store test: two fileRequest calls with the same idempotency key return the same record and debit once.",
          "status": "pending",
          "verification": "pnpm test"
        },
        {
          "id": "t2",
          "description": "Thread the client request id (already a UUID) as the idempotency key through hcmApi, wire.ts and both transports.",
          "status": "pending",
          "verification": "pnpm test"
        },
        {
          "id": "t3",
          "description": "Revisit submitFlow's hcm_silent path: with idempotency, retry-after-silence can become safe and automatic for ONE attempt; update FSM tests and TRD §6.5 accordingly.",
          "status": "pending",
          "verification": "pnpm test && pnpm test:e2e"
        }
      ],
      "acceptance": [
        "Duplicate submissions are structurally impossible, not just unlikely"
      ],
      "artifacts": [
        "src/mocks/hcmStore.ts",
        "src/mocks/wire.ts",
        "src/data/submitFlow.ts",
        "docs/TRD.md"
      ]
    },
    {
      "id": "phase-4",
      "title": "Demo-surface gating",
      "goal": "Chaos header, reset and anniversary trigger are env-gated: enabled in dev/test/demo, absent in production builds (TRD §13.3-3).",
      "dependsOn": [],
      "parallelizable": false,
      "status": "pending",
      "tasks": [
        {
          "id": "t1",
          "description": "Failing route tests: with HCM_TEST_SURFACES!=1, reset/trigger return 404 and x-chaos is ignored.",
          "status": "pending",
          "verification": "pnpm test"
        },
        {
          "id": "t2",
          "description": "Gate in routeHelpers + reset/trigger handlers; e2e/CI/Vercel demo set the env explicitly.",
          "status": "pending",
          "verification": "pnpm test:e2e (env set) + manual: prod build without env hides surfaces"
        }
      ],
      "acceptance": [
        "A production deployment without the flag exposes no test surface"
      ],
      "artifacts": [
        "src/mocks/routeHelpers.ts",
        "src/app/api/hcm/",
        ".github/workflows/ci.yml",
        "playwright.config.ts"
      ]
    },
    {
      "id": "phase-5",
      "title": "Scoped realtime + transport hardening",
      "goal": "SSE feed filtered to the authenticated user's visibility; rate limiting on writes; CSP/CORS headers (TRD §13.3-2/5).",
      "dependsOn": ["phase-1"],
      "parallelizable": false,
      "status": "pending",
      "tasks": [
        {
          "id": "t1",
          "description": "Failing test: employee session receives only its own cells/requests over SSE; manager receives their reports'.",
          "status": "pending",
          "verification": "pnpm test"
        },
        {
          "id": "t2",
          "description": "Filter events server-side by session in the SSE route; add basic rate limit to POST/PATCH handlers.",
          "status": "pending",
          "verification": "pnpm test && pnpm test:e2e"
        },
        {
          "id": "t3",
          "description": "next.config: CSP and CORS headers; verify nothing breaks Storybook/e2e.",
          "status": "pending",
          "verification": "pnpm build && pnpm test:e2e && pnpm test:storybook"
        }
      ],
      "acceptance": [
        "No user can observe another user's balances through the event feed"
      ],
      "artifacts": [
        "src/app/api/hcm/events/route.ts",
        "src/mocks/routeHelpers.ts",
        "next.config.ts"
      ]
    },
    {
      "id": "phase-6",
      "title": "Observability of contradictions",
      "goal": "The system's health signal IS its contradiction rate: count verify-mismatch/conflict/silent events, expose a /api/metrics endpoint and surface trends (a spike means HCM drift or a bug).",
      "dependsOn": ["phase-4"],
      "parallelizable": true,
      "status": "pending",
      "tasks": [
        {
          "id": "t1",
          "description": "Failing test: submitFlow outcomes increment typed counters (confirmed/contradicted-by-reason/denied).",
          "status": "pending",
          "verification": "pnpm test"
        },
        {
          "id": "t2",
          "description": "Minimal metrics module + endpoint; document alert thresholds in TRD §11.",
          "status": "pending",
          "verification": "pnpm test && curl /api/metrics shows counters"
        }
      ],
      "acceptance": [
        "A silent-failure storm is visible in metrics before users report it"
      ],
      "artifacts": [
        "src/data/submitFlow.ts",
        "src/app/api/metrics/",
        "docs/TRD.md"
      ]
    }
  ]
}
